{
  "event_id": "55555555-5555-4555-8555-000000000003",
  "schema_version": 1,
  "occurred_at": "2026-10-05T06:40:12Z",
  "correlation_id": "11111111-1111-4111-8111-111111111111",
  "aggregate_id": "44444444-4444-4444-8444-444444444444",
  "aggregate_version": 1,
  "event_type": "OrderConfirmed",
  "data": {
    "order_id": "44444444-4444-4444-8444-444444444444",
    "checkout_id": "11111111-1111-4111-8111-111111111111",
    "customer_id": "demo-customer-001",
    "items": [
      {
        "sku": "FLASH-001",
        "quantity": 1,
        "unit_price_minor": 99900
      }
    ],
    "amount_minor": 99900,
    "currency": "INR",
    "delivery_address": {
      "street": "12 Example Street",
      "city": "Coimbatore",
      "state": "Tamil Nadu",
      "postal_code": "641001",
      "country": "IN"
    }
  }
}
